{
  "schema_version": "0.1.0",
  "result_id": "standing-result-allow-001",
  "candidate_id": "candidate-ara-demo-001",
  "decision": "ALLOW",
  "standing_valid": true,
  "checks": {
    "authority_valid": true,
    "policy_valid": true,
    "delegation_valid": true,
    "evidence_admissible": true,
    "scope_valid": true,
    "context_valid": true,
    "recoverability_valid": true
  },
  "commit_time": "2026-06-24T00:00:00Z",
  "reasons": [
    {
      "code": "ALLOW_CITATION_ONLY_SCOPE",
      "message": "The requested action is limited to citation and interoperability discussion, with explicit non-claims and reversible use."
    }
  ]
}
